{
  "$schema": "https://json-schema.org/draft/2020-12/schema",
  "$id": "https://buem.energy/schemas/contract/v6-draft/response",
  "title": "BUEM GeoJSON Response Schema (API contract v6-draft)",
  "description": "Response schema for the BUEM building energy model. Echoes the request structure and adds thermal_load_profile and model_metadata to each feature's buem node. All output quantities carry explicit unit fields. Timeseries arrays declare their unit once at the array level. Draft, not yet promoted — see v6-draft-contract-backlog for open items, including this file's own hot_water/kitchen additions below.",
  "type": "object",
  "required": ["type", "features"],
  "properties": {
    "type": {
      "const": "FeatureCollection",
      "description": "GeoJSON type identifier"
    },
    "timeStamp": {
      "type": "string",
      "format": "date-time",
      "description": "Response timestamp"
    },
    "processed_at": {
      "type": "string",
      "format": "date-time",
      "description": "Timestamp when processing completed"
    },
    "processing_elapsed_s": {
      "type": "number",
      "description": "Total wall-clock time for the full request in seconds"
    },
    "metadata": { "$ref": "#/$defs/collection_metadata" },
    "features": {
      "type": "array",
      "items": { "$ref": "#/$defs/feature" },
      "description": "Array of processed building features with results appended"
    }
  },

  "$defs": {

    "collection_metadata": {
      "type": "object",
      "description": "Aggregate processing statistics for the feature collection",
      "required": ["total_features", "successful_features", "failed_features"],
      "properties": {
        "total_features": {
          "type": "integer",
          "minimum": 0,
          "description": "Total number of features received"
        },
        "successful_features": {
          "type": "integer",
          "minimum": 0,
          "description": "Number of features successfully processed"
        },
        "failed_features": {
          "type": "integer",
          "minimum": 0,
          "description": "Number of features that failed processing"
        },
        "validation_warnings": {
          "type": "integer",
          "minimum": 0,
          "description": "Total number of validation warnings across all features"
        }
      }
    },

    "feature": {
      "type": "object",
      "required": ["type", "id", "geometry", "properties"],
      "properties": {
        "type": { "const": "Feature" },
        "id": {
          "type": "string",
          "description": "Building identifier — echoed from request"
        },
        "geometry": { "$ref": "#/$defs/geometry" },
        "properties": { "$ref": "#/$defs/properties" }
      }
    },

    "geometry": {
      "type": "object",
      "required": ["type", "coordinates"],
      "properties": {
        "type": { "const": "Point" },
        "coordinates": {
          "type": "array",
          "items": { "type": "number" },
          "minItems": 2,
          "maxItems": 3,
          "description": "Geographic coordinates [longitude, latitude, elevation?] — echoed from request"
        }
      }
    },

    "properties": {
      "type": "object",
      "required": ["start_time", "end_time", "resolution", "resolution_unit", "buem"],
      "properties": {
        "start_time": {
          "type": "string",
          "format": "date-time",
          "description": "Simulation start time — echoed from request"
        },
        "end_time": {
          "type": "string",
          "format": "date-time",
          "description": "Simulation end time — echoed from request"
        },
        "resolution": {
          "type": "string",
          "description": "Time resolution value — echoed from request"
        },
        "resolution_unit": {
          "type": "string",
          "description": "Time resolution unit — echoed from request"
        },
        "buem": { "$ref": "#/$defs/buem" }
      }
    },

    "buem": {
      "type": "object",
      "required": ["building", "thermal_load_profile"],
      "description": "Echoes the request buem node (building, solver, inputs, weather) and appends thermal_load_profile and model_metadata",
      "properties": {
        "building":             { "type": "object", "description": "Echoed from request — contains name (optional display label), envelope, thermal, and all classification fields" },
        "solver":               { "type": "object", "description": "Echoed from request" },
        "inputs":               { "type": "object", "description": "Echoed from request — user-provided timeseries inputs, if any were supplied" },
        "weather":              { "type": "object", "description": "Echoed from request when present — the resolved hourly timeseries the model ran against" },
        "thermal_load_profile": { "$ref": "#/$defs/thermal_load_profile" },
        "model_metadata":       { "$ref": "#/$defs/model_metadata" }
      }
    },

    "thermal_load_profile": {
      "type": "object",
      "required": ["start_time", "end_time", "resolution", "resolution_unit", "summary"],
      "description": "Computed thermal load results for the building",
      "properties": {
        "start_time": {
          "type": "string",
          "format": "date-time",
          "description": "First timestamp in the simulation output"
        },
        "end_time": {
          "type": "string",
          "format": "date-time",
          "description": "Last timestamp in the simulation output"
        },
        "resolution": {
          "type": "string",
          "description": "Time resolution of the output"
        },
        "resolution_unit": {
          "type": "string",
          "description": "Unit of the time resolution"
        },
        "summary":        { "$ref": "#/$defs/load_summary" },
        "timeseries":     { "$ref": "#/$defs/load_timeseries" },
        "timeseries_file": {
          "type": "string",
          "description": "Path of the intermediate .json.gz file buem-model writes when the request sets save_timeseries_file (buem-model 6.4.0 and later). buem-gateway never requests the file, so its responses do not carry this field."
        }
      }
    },

    "load_summary": {
      "type": "object",
      "description": "Aggregated statistics over the full simulation period, one entry per profile the request selected (outputs set to summary or series; every profile when outputs is omitted). A selected profile buem-model cannot produce is reported as all-zero rather than left out: hot_water and kitchen for service building_type, kitchen with electric cooking. peak_heating_load is present when heating is selected and peak_cooling_load when cooling is selected. total_energy_demand is present only when heating, cooling, electricity and hot_water are all selected.",
      "properties": {
        "heating":     { "$ref": "#/$defs/energy_summary" },
        "cooling":     { "$ref": "#/$defs/energy_summary" },
        "electricity": { "$ref": "#/$defs/energy_summary" },
        "hot_water": {
          "allOf": [{ "$ref": "#/$defs/energy_summary" }],
          "description": "Domestic hot water useful-heat DEMAND — fuel-agnostic (what the building's systems must deliver, same family as heating/cooling), not literal delivered energy of any one carrier. Included in total_energy_demand below. All-zero for a service building_type (bakery, clinic, hotel, office, restaurant, school, supermarket, warehouse) — BuEM has no hot water model for service buildings, regardless of include_dhw."
        },
        "kitchen": {
          "allOf": [{ "$ref": "#/$defs/gas_energy_summary" }],
          "description": "Estimated cooking GAS energy — literal delivered gas (a national heating:cooking ratio proxy, not metered or physically modelled), not a fuel-agnostic demand figure like hot_water. A different fuel carrier from every other field in this summary, marked with its own kWh_gas/kW_gas units for that reason. NOT included in total_energy_demand below — folding a gas quantity into an otherwise thermal/electric total remains an open question. All-zero for a service building_type (bakery, clinic, hotel, office, restaurant, school, supermarket, warehouse) — BuEM has no cooking model for service buildings, regardless of cooking_carrier."
        },
        "total_energy_demand": {
          "allOf": [{ "$ref": "#/$defs/energy_qty" }],
          "description": "Sum of heating, cooling, electricity and hot_water over the simulation period, present only when all four are selected so that it always means the same quantity. Does not include kitchen, see its own description."
        },
        "peak_heating_load": {
          "allOf": [{ "$ref": "#/$defs/power_qty" }],
          "description": "Maximum instantaneous heating load"
        },
        "peak_cooling_load": {
          "allOf": [{ "$ref": "#/$defs/power_qty" }],
          "description": "Maximum instantaneous cooling load"
        },
        "energy_intensity": {
          "allOf": [{ "$ref": "#/$defs/energy_intensity_qty" }],
          "description": "total_energy_demand divided by building.A_ref. Present when total_energy_demand is present."
        }
      }
    },

    "energy_summary": {
      "type": "object",
      "required": ["total", "max", "min", "mean"],
      "description": "Statistical summary for one energy carrier over the simulation period",
      "properties": {
        "total": {
          "allOf": [{ "$ref": "#/$defs/energy_qty" }],
          "description": "Total energy over the simulation period"
        },
        "max": {
          "allOf": [{ "$ref": "#/$defs/power_qty" }],
          "description": "Peak instantaneous power"
        },
        "min": {
          "allOf": [{ "$ref": "#/$defs/power_qty" }],
          "description": "Minimum instantaneous power"
        },
        "mean": {
          "allOf": [{ "$ref": "#/$defs/power_qty" }],
          "description": "Mean power over the simulation period"
        },
        "median": {
          "allOf": [{ "$ref": "#/$defs/power_qty" }],
          "description": "Median power over the simulation period"
        },
        "std": {
          "allOf": [{ "$ref": "#/$defs/power_qty" }],
          "description": "Standard deviation of power over the simulation period"
        }
      }
    },

    "gas_energy_summary": {
      "type": "object",
      "required": ["total", "max", "min", "mean"],
      "description": "Statistical summary for a GAS energy carrier over the simulation period — same shape as energy_summary, but the quantities carry gas-specific units (kWh_gas/kW_gas) so a consumer can never mistake this for electric or thermal energy.",
      "properties": {
        "total": {
          "allOf": [{ "$ref": "#/$defs/gas_energy_qty" }],
          "description": "Total gas energy over the simulation period"
        },
        "max": {
          "allOf": [{ "$ref": "#/$defs/gas_power_qty" }],
          "description": "Peak instantaneous gas power"
        },
        "min": {
          "allOf": [{ "$ref": "#/$defs/gas_power_qty" }],
          "description": "Minimum instantaneous gas power"
        },
        "mean": {
          "allOf": [{ "$ref": "#/$defs/gas_power_qty" }],
          "description": "Mean gas power over the simulation period"
        },
        "median": {
          "allOf": [{ "$ref": "#/$defs/gas_power_qty" }],
          "description": "Median gas power over the simulation period"
        },
        "std": {
          "allOf": [{ "$ref": "#/$defs/gas_power_qty" }],
          "description": "Standard deviation of gas power over the simulation period"
        }
      }
    },

    "load_timeseries": {
      "type": "object",
      "required": ["unit", "timestamps"],
      "description": "Hourly timeseries arrays, one per profile the request set to series. unit applies to every array except kitchen, which is gas and carries its own kitchen_unit (same electric/thermal-vs-gas split as load_summary's energy_summary vs gas_energy_summary). kitchen is present only with gas cooking.",
      "properties": {
        "unit": {
          "const": "kW",
          "description": "Unit for the heating, cooling, electricity, and hot_water arrays. Always kW"
        },
        "kitchen_unit": {
          "type": "string",
          "enum": ["kW_gas", "W_gas", "MW_gas"],
          "default": "kW_gas",
          "description": "Unit for the kitchen array specifically — gas, never electric or thermal. Present whenever kitchen is."
        },
        "timestamps": {
          "type": "array",
          "items": { "type": "string", "format": "date-time" },
          "description": "ISO 8601 timestamps, one per time step"
        },
        "heating": {
          "type": "array",
          "items": { "type": "number" },
          "description": "Heating load at each time step"
        },
        "cooling": {
          "type": "array",
          "items": { "type": "number" },
          "description": "Cooling load at each time step"
        },
        "electricity": {
          "type": "array",
          "items": { "type": "number" },
          "description": "Electricity consumption at each time step"
        },
        "hot_water": {
          "type": "array",
          "items": { "type": "number" },
          "description": "Domestic hot water useful-heat energy at each time step. All-zero for a service building_type — see load_summary.hot_water."
        },
        "kitchen": {
          "type": "array",
          "items": { "type": "number" },
          "description": "Estimated gas-cooking power at each time step — see kitchen_unit above, not unit. All-zero for a service building_type — see load_summary.kitchen."
        }
      }
    },

    "model_metadata": {
      "type": "object",
      "description": "Diagnostic information about the model run",
      "properties": {
        "resolved_inputs": {
          "type": "object",
          "description": "The occupancy inputs buem-model actually used for this building, after applying defaults. A field that does not apply to the building_type is null.",
          "properties": {
            "building_type":     { "type": "string" },
            "country":           { "type": "string" },
            "region_code":       { "type": ["string", "null"] },
            "num_persons":       { "type": ["number", "null"], "description": "Occupants per dwelling; a fractional value is the statistical mean buem-model blended from two household sizes. null for service building_type." },
            "residential_units": { "type": "number" },
            "archetype":         { "type": ["string", "null"], "description": "Household archetype. null for service building_type." },
            "capacity":          { "type": ["integer", "null"], "description": "Occupant capacity. null for residential building_type." }
          }
        },
        "model_version": {
          "type": "string",
          "description": "buem-model release that computed this feature, e.g. 6.10.0. model_commit tells apart images built outside a release."
        },
        "model_commit": {
          "type": "string",
          "description": "buem-model commit that computed this feature, or unknown when the image does not record it."
        },
        "solver_used": {
          "type": "string",
          "description": "Solver selected for the run (e.g. scipy-sparse, OSQP, CBC)"
        },
        "processing_time": {
          "allOf": [{ "$ref": "#/$defs/duration_qty" }],
          "description": "Wall-clock time for this feature"
        },
        "weather_year": {
          "type": "integer",
          "description": "Calendar year of the weather data used"
        },
        "validation_warnings": {
          "type": "array",
          "items": { "type": "string" },
          "description": "Any validation warnings generated during processing"
        }
      }
    },

    "measurement": {
      "type": "object",
      "required": ["value"],
      "description": "Base type for all measurable quantities. Unit defaults to SI when omitted.",
      "properties": {
        "value": { "type": "number" },
        "unit":  { "type": "string" }
      }
    },

    "energy_qty": {
      "allOf": [{ "$ref": "#/$defs/measurement" }],
      "properties": {
        "value": { "minimum": 0 },
        "unit":  { "enum": ["kWh", "MWh", "Wh"], "default": "kWh" }
      }
    },

    "power_qty": {
      "allOf": [{ "$ref": "#/$defs/measurement" }],
      "properties": {
        "unit": { "enum": ["kW", "W", "MW"], "default": "kW" }
      }
    },

    "gas_energy_qty": {
      "allOf": [{ "$ref": "#/$defs/measurement" }],
      "description": "Same as energy_qty but explicitly the gas fuel carrier, never electric or thermal.",
      "properties": {
        "value": { "minimum": 0 },
        "unit":  { "enum": ["kWh_gas", "MWh_gas", "Wh_gas"], "default": "kWh_gas" }
      }
    },

    "gas_power_qty": {
      "allOf": [{ "$ref": "#/$defs/measurement" }],
      "description": "Same as power_qty but explicitly the gas fuel carrier, never electric or thermal.",
      "properties": {
        "unit": { "enum": ["kW_gas", "W_gas", "MW_gas"], "default": "kW_gas" }
      }
    },

    "energy_intensity_qty": {
      "allOf": [{ "$ref": "#/$defs/measurement" }],
      "properties": {
        "value": { "minimum": 0 },
        "unit":  { "enum": ["kWh/m2", "kWh/ft2"], "default": "kWh/m2" }
      }
    },

    "duration_qty": {
      "allOf": [{ "$ref": "#/$defs/measurement" }],
      "properties": {
        "value": { "minimum": 0 },
        "unit":  { "enum": ["s", "ms", "min"], "default": "s" }
      }
    }

  }
}
